{
  "schema_version": "1",
  "model": "orders",
  "dimensions": [
    {
      "field": "ordered_at",
      "time_grain": "month"
    }
  ],
  "metrics": [
    {
      "metric": "revenue"
    }
  ],
  "filters": {
    "op": "gte",
    "field": "ordered_at",
    "value": {
      "type": "date",
      "value": "2026-01-01"
    }
  },
  "order_by": [
    {
      "ref": "ordered_at",
      "direction": "asc"
    }
  ],
  "limit": 12
}
